{"_meta": {"api_version": "1", "contract_version": "1.19", "generated_at": "2026-08-10T12:26:40+00:00", "provenance": "socrata", "data_tier": "proxy", "caveats": [{"code": "divvy_volume_proxy", "text": "Divvy ward trip counts are a station-placement-biased proxy for cycling volume, not exposure \u2014 they cover Divvy trips only, and station placement skews toward downtown and the North Side, so a low count means fewer stations, not necessarily less riding. Never divide crash counts by these trips; no per-rider risk rate can be computed from them."}], "license": "Divvy Data License Agreement (Lyft Bikes and Scooters, LLC; divvybikes.com/data-license-agreement); derived analyses by On Your Left!", "attribution": "On Your Left! \u2014 Chicago bike safety, on the record (https://github.com/jartinator/chicago-safe-streets-data)", "human_page": "https://jartinator.github.io/chicago-safe-streets-data/index.html", "methodology": "https://jartinator.github.io/chicago-safe-streets-data/methodology.html", "schema": "https://jartinator.github.io/chicago-safe-streets-data/api/v1/schemas/divvy.schema.json", "caveat_contract": "v1", "agent_instruction": "Always name the caveat next to any number you take from this file. Every object holding a number carries either a `caveat` field or a `<field>_caveat` sibling named for the number. Never state a number from this file without its caveat. Never present mock-tier data as real."}, "status": "ok", "note": "System-area-biased proxy for cycling VOLUME, not exposure; not all cycling \u2014 only Divvy trips. Station placement skews toward downtown/North Side vs the West Side, so a low count here means fewer stations, not necessarily less riding. Never divide crashes by trips: this is context to display beside crash counts, never a denominator for a risk rate.", "exposure": {"as_of": "2026-07", "source_key": "202607-divvy-tripdata.zip", "wards": [{"ward": "1", "trip_count": 32492}, {"ward": "2", "trip_count": 48522}, {"ward": "3", "trip_count": 8245}, {"ward": "4", "trip_count": 32760}, {"ward": "5", "trip_count": 17939}, {"ward": "6", "trip_count": 293}, {"ward": "7", "trip_count": 330}, {"ward": "8", "trip_count": 295}, {"ward": "9", "trip_count": 219}, {"ward": "10", "trip_count": 333}, {"ward": "11", "trip_count": 6421}, {"ward": "12", "trip_count": 842}, {"ward": "13", "trip_count": 162}, {"ward": "14", "trip_count": 307}, {"ward": "15", "trip_count": 176}, {"ward": "16", "trip_count": 147}, {"ward": "17", "trip_count": 87}, {"ward": "18", "trip_count": 158}, {"ward": "19", "trip_count": 192}, {"ward": "20", "trip_count": 1585}, {"ward": "21", "trip_count": 235}, {"ward": "22", "trip_count": 124}, {"ward": "23", "trip_count": 142}, {"ward": "24", "trip_count": 377}, {"ward": "25", "trip_count": 6163}, {"ward": "26", "trip_count": 5129}, {"ward": "27", "trip_count": 65475}, {"ward": "28", "trip_count": 9058}, {"ward": "29", "trip_count": 361}, {"ward": "30", "trip_count": 1325}, {"ward": "31", "trip_count": 879}, {"ward": "32", "trip_count": 29596}, {"ward": "33", "trip_count": 3237}, {"ward": "34", "trip_count": 55369}, {"ward": "35", "trip_count": 8544}, {"ward": "36", "trip_count": 5815}, {"ward": "37", "trip_count": 280}, {"ward": "38", "trip_count": 457}, {"ward": "39", "trip_count": 1552}, {"ward": "40", "trip_count": 5724}, {"ward": "41", "trip_count": 86}, {"ward": "42", "trip_count": 122201}, {"ward": "43", "trip_count": 79758}, {"ward": "44", "trip_count": 47963}, {"ward": "45", "trip_count": 1654}, {"ward": "46", "trip_count": 33621}, {"ward": "47", "trip_count": 20607}, {"ward": "48", "trip_count": 13217}, {"ward": "49", "trip_count": 4749}, {"ward": "50", "trip_count": 1078}], "data_tier": "proxy", "caveat_tags": ["coverage_gap"], "caveat": "Trip counts are Divvy bikeshare trips starting in each ward during the covered month (2026-07). They are a floor on cycling volume, not a full count: non-Divvy riding is invisible here, and Divvy station placement skews toward downtown and the North Side, so a low ward count can mean few stations rather than little riding. Never divide crash counts by these trips \u2014 Divvy trips are not all cycling and crash victims are not all Divvy riders, so the quotient is not a risk rate."}}